{
  "murlVersion": "0.2",
  "name": "Signed shape",
  "signature": {
    "alg": "ed25519",
    "keyId": "ed25519:0123456789abcdef",
    "publicKey": "AAAAAAAAAAAAAAAAAAAAAAAAAAAAAAAAAAAAAAAAAAA=",
    "sig": "AAAAAAAAAAAAAAAAAAAAAAAAAAAAAAAAAAAAAAAAAAAAAAAAAAAAAAAAAAAAAAAAAAAAAAAAAAAAAAAAAAAAAA=="
  },
  "resources": [
    {
      "id": "a",
      "kind": "https",
      "target": "https://example.com/a"
    }
  ]
}
